[
  { "schoolId": "10001", "name": "北京大学", "province": "北京市", "city": "北京市", "county": "海淀区", "lng": 116.3054, "lat": 39.9869, "level": "985", "is985": true, "is211": true, "isDoubleFirst": true, "intro": "示例数据：综合类顶尖高校，理学/工学/医学强势。" },
  { "schoolId": "10003", "name": "清华大学", "province": "北京市", "city": "北京市", "county": "海淀区", "lng": 116.3264, "lat": 40.0033, "level": "985", "is985": true, "is211": true, "isDoubleFirst": true, "intro": "示例数据：工科顶尖，计算机/电子/建筑强势。" },
  { "schoolId": "10335", "name": "浙江大学", "province": "浙江省", "city": "杭州市", "county": "西湖区", "lng": 120.0887, "lat": 30.3069, "level": "985", "is985": true, "is211": true, "isDoubleFirst": true, "intro": "示例数据：综合性强校，计算机/农学/医学强势。" },
  { "schoolId": "10486", "name": "武汉大学", "province": "湖北省", "city": "武汉市", "county": "武昌区", "lng": 114.3660, "lat": 30.5420, "level": "985", "is985": true, "is211": true, "isDoubleFirst": true, "intro": "示例数据：测绘/法学/新闻强势，报考热度高。" },
  { "schoolId": "10487", "name": "华中科技大学", "province": "湖北省", "city": "武汉市", "county": "洪山区", "lng": 114.4195, "lat": 30.5150, "level": "985", "is985": true, "is211": true, "isDoubleFirst": true, "intro": "示例数据：工医强校，光电/计算机/临床强势。" },
  { "schoolId": "10246", "name": "复旦大学", "province": "上海市", "city": "上海市", "county": "杨浦区", "lng": 121.5034, "lat": 31.2961, "level": "985", "is985": true, "is211": true, "isDoubleFirst": true, "intro": "示例数据：文理医强校，新闻/经济/临床强势。" }
]
